%description:
Test connection setup: A does active open, B does passive open. Both SYN and
SYN+ACK get duplicated, and pop up several times -- this should cause no
problem for TCP.

%inifile: {}.ini
[General]
preload-ned-files = *.ned ../../*.ned @../../../../nedfiles.lst

[Cmdenv]
event-banners=false

[Parameters]
*.testing=true

*.cli.tOpen=0
*.srv.tOpen=0

*.cli.tSend=1
*.cli.sendBytes=100
*.srv.tSend=1
*.srv.sendBytes=100

*.tcptester.script="A1 copy 0, 0, 0.1, 1, 5; B1 copy 0, 0, 0.1, 1, 5"

include ../../defaults.ini

%contains: stdout
tcpcli: INIT --> SYN_SENT  (on OPEN_ACTIVE)
tcpsrv: INIT --> LISTEN  (on OPEN_PASSIVE)
[0.001 A001] A.1000 > B.2000: S 0:0(0) win 16384 # removing original
[0.001 A001] A.1000 > B.2000: S 0:0(0) win 16384 # introducing copy
[0.001 A001] A.1000 > B.2000: S 0:0(0) win 16384 # introducing copy
tcpsrv: LISTEN --> SYN_RCVD  (on RCV_SYN)
[0.003 B001] B.2000 > A.1000: S 500:500(0) ack 1 win 16384 # removing original
[0.003 B001] B.2000 > A.1000: S 500:500(0) ack 1 win 16384 # introducing copy
[0.003 B001] B.2000 > A.1000: S 500:500(0) ack 1 win 16384 # introducing copy
[0.003 B002] B.2000 > A.1000: . ack 1 win 16384
tcpcli: SYN_SENT --> ESTABLISHED  (on RCV_SYN_ACK)
[0.005 A002] A.1000 > B.2000: . ack 501 win 16384
[0.005 A003] A.1000 > B.2000: . ack 501 win 16384
tcpsrv: SYN_RCVD --> ESTABLISHED  (on RCV_ACK)
[0.101 A003] A.1000 > B.2000: S 0:0(0) win 16384 # introducing copy
[0.103 B002] B.2000 > A.1000: S 500:500(0) ack 1 win 16384 # introducing copy
[0.103 B003] B.2000 > A.1000: . ack 1 win 16384
[0.105 A004] A.1000 > B.2000: . ack 501 win 16384
[1.001 A004] A.1000 > B.2000: S 0:0(0) win 16384 # introducing copy
[1.001 A005] A.1000 > B.2000: . 1:101(100) ack 501 win 16384
[1.001 B004] B.2000 > A.1000: . 501:601(100) ack 1 win 16384
[1.003 B005] B.2000 > A.1000: . ack 1 win 16384
[1.003 B005] B.2000 > A.1000: S 500:500(0) ack 1 win 16384 # introducing copy
[1.005 A006] A.1000 > B.2000: . ack 601 win 16384
[1.203 B006] B.2000 > A.1000: . ack 101 win 16384
[5.001 A006] A.1000 > B.2000: S 0:0(0) win 16384 # introducing copy
[5.003 B006] B.2000 > A.1000: S 500:500(0) ack 1 win 16384 # introducing copy
[5.003 B007] B.2000 > A.1000: . ack 101 win 16384
[5.005 A007] A.1000 > B.2000: . ack 601 win 16384

%contains: stdout
tcpTestNet1.cli: received 100 bytes in 1 packets
tcpTestNet1.srv: received 100 bytes in 1 packets
[5.006] tcpdump finished, A:7 B:7 segments

